{"causation_id":null,"correlation_id":"corr_xau_20260716_0001","disposition":{"detail":"M1 reaction confirmed at a valid SNR.","reason_code":"REACTION_CONFIRMED","status":"ACCEPTED"},"event_class":"ANALYSIS_READY","event_id":"evt_xau_20260716_0001","event_type":"SNR_REJECTION_READY","hypothesis":"LONG","instrument":{"point_size":0.01,"symbol":"XAUUSD","venue":"ICMARKETS"},"occurred_at":"2026-07-16T00:00:00Z","path":"SNR_REJECTION","payload":{"analysis":{"bar_time":"2026-07-16T00:00:00Z","entry_candidate":2416.5,"expires_at":"2026-07-16T00:10:00Z","hpa":["M15_DISCOUNT","M5_DISCOUNT"],"hpa_evidence":"Fixture M15 and M5 discount context.","momentum":{"15m":{"classification":"WEAK_PUSH","direction":"SHORT","source":"FIXTURE"},"1m":{"classification":"EXHAUSTING","direction":"SHORT","source":"FIXTURE"},"30m":{"classification":"RANGE_DRIFT","direction":"NEUTRAL","source":"FIXTURE"},"5m":{"classification":"WEAK_PUSH","direction":"SHORT","source":"FIXTURE"},"5s":{"classification":"UNAVAILABLE","direction":null,"source":"FIXTURE"}},"session":"ASIAN","sl_candidate":2414.5,"snr":{"high":2416.0,"low":2415.0,"type":"CLASSIC"},"snr_evidence":"Frozen fixture M1 reaction at valid SNR.","source_event_ids":["evt_xau_20260716_0001"],"spread_points":8,"tp_candidate":2418.5,"trigger_price":2416.5,"trigger_reason":"REACTION_CONFIRMED"},"session":"ASIAN","snr_high":2416.0,"snr_low":2415.0,"trigger_price":2416.5},"received_at":"2026-07-16T00:00:01Z","schema_version":"0.2","setup_id":"setup_xau_20260716_0001","source":{"engine":"FIXTURE","payload_hash":"sha256:aaaaaaaaaaaaaaaaaaaaaaaaaaaaaaaaaaaaaaaaaaaaaaaaaaaaaaaaaaaaaaaa","producer":"project-a-fixture","provenance":"LOCAL_REPLAY","sensitive_fields_redacted":true},"timeframe":"1m"}
